{
  "$schema": "https://sse-hooks.vercel.app/api/registry/schema/hook.json",
  "name": "use-history-state",
  "type": "registry:hook",
  "title": "useHistoryState",
  "description": "Internal state structure for the history reducer.",
  "dependencies": [
    "react"
  ],
  "registryDependencies": [],
  "api": {
    "tags": {
      "category": "state",
      "template": "- The type of the state being managed.",
      "see": "[Documentation](https://sse-hooks.vercel.app/docs/hooks/use-history-state)",
      "public": true
    },
    "types": [],
    "parameters": [
      {
        "name": "initialPresent",
        "type": "T",
        "isOptional": false,
        "description": "- The initial value to populate the state history."
      }
    ],
    "returnType": {
      "name": "HistoryState<T>",
      "description": "An object containing the current state, control functions, and status booleans.",
      "properties": [
        {
          "name": "state",
          "type": "T",
          "isOptional": false,
          "description": "The current value of the state."
        },
        {
          "name": "set",
          "type": "(newPresent: T) => void",
          "isOptional": false,
          "description": "Function to update the current state and push the previous state to history."
        },
        {
          "name": "undo",
          "type": "() => void",
          "isOptional": false,
          "description": "Reverts the state to the previous value in history."
        },
        {
          "name": "redo",
          "type": "() => void",
          "isOptional": false,
          "description": "Advances the state to the next value in the redo stack."
        },
        {
          "name": "clear",
          "type": "() => void",
          "isOptional": false,
          "description": "Resets the state to the initial value and clears all history."
        },
        {
          "name": "canUndo",
          "type": "boolean",
          "isOptional": false,
          "description": "Boolean indicating if there is history available to undo."
        },
        {
          "name": "canRedo",
          "type": "boolean",
          "isOptional": false,
          "description": "Boolean indicating if there are values available to redo."
        }
      ]
    }
  },
  "file": {
    "path": "use-history-state.ts",
    "content": "/**\n * Internal state structure for the history reducer.\n * @template T The type of the state value being tracked.\n */\nexport interface HistoryStateInternal<T> {\n  /** Array of previous state values. */\n  past: T[];\n  /** The current state value. */\n  present: T;\n  /** Array of state values that were undone and can be redone. */\n  future: T[];\n}\n\n/**\n * Union of all possible actions that can be dispatched to the history reducer.\n * @template T The type of the state value.\n */\nexport type HistoryAction<T> =\n  | { type: \"UNDO\" }\n  | { type: \"REDO\" }\n  | { type: \"SET\"; newPresent: T }\n  | { type: \"CLEAR\"; initialPresent: T };\n\n/**\n * The public API returned by the useHistoryState hook.\n * @template T The type of the state value.\n */\nexport type HistoryState<T> = {\n  /** The current value of the state. */\n  state: T;\n  /** Function to update the current state and push the previous state to history. */\n  set: (newPresent: T) => void;\n  /** Reverts the state to the previous value in history. */\n  undo: () => void;\n  /** Advances the state to the next value in the redo stack. */\n  redo: () => void;\n  /** Resets the state to the initial value and clears all history. */\n  clear: () => void;\n  /** Boolean indicating if there is history available to undo. */\n  canUndo: boolean;\n  /** Boolean indicating if there are values available to redo. */\n  canRedo: boolean;\n};\n\nexport const useHistoryStateReducer = <T,>(\n  state: HistoryStateInternal<T>,\n  action: HistoryAction<T>,\n): HistoryStateInternal<T> => {\n  const { past, present, future } = state;\n\n  switch (action.type) {\n    case \"UNDO\":\n      if (past.length === 0) return state;\n      return {\n        past: past.slice(0, past.length - 1),\n        present: past[past.length - 1],\n        future: [present, ...future],\n      };\n\n    case \"REDO\":\n      if (future.length === 0) return state;\n      return {\n        past: [...past, present],\n        present: future[0],\n        future: future.slice(1),\n      };\n\n    case \"SET\":\n      if (action.newPresent === present) return state;\n      return {\n        past: [...past, present],\n        present: action.newPresent,\n        future: [],\n      };\n\n    case \"CLEAR\":\n      return {\n        past: [],\n        present: action.initialPresent,\n        future: [],\n      };\n\n    default:\n      throw new Error(\"Unsupported action type\");\n  }\n};\n\n/**\n * Custom hook for managing state history, providing undo, redo, and clear functionality.\n * @category state\n * @template T - The type of the state being managed.\n * @param {T} initialPresent - The initial value to populate the state history.\n * @returns {HistoryState<T>} An object containing the current state, control functions, and status booleans.\n * @see [Documentation](https://sse-hooks.vercel.app/docs/hooks/use-history-state)\n * @public\n */\nexport function useHistoryState<T>(initialPresent: T): HistoryState<T> {\n  const initialPresentRef = useRef(initialPresent);\n\n  const [state, dispatch] = useReducer(\n    (s: HistoryStateInternal<T>, a: HistoryAction<T>) =>\n      useHistoryStateReducer<T>(s, a),\n    {\n      past: [],\n      present: initialPresentRef.current,\n      future: [],\n    },\n  );\n\n  const canUndo = state.past.length !== 0;\n  const canRedo = state.future.length !== 0;\n\n  const undo = useCallback(() => {\n    if (canUndo) dispatch({ type: \"UNDO\" });\n  }, [canUndo]);\n\n  const redo = useCallback(() => {\n    if (canRedo) dispatch({ type: \"REDO\" });\n  }, [canRedo]);\n\n  const set = useCallback(\n    (newPresent: T) => dispatch({ type: \"SET\", newPresent }),\n    [],\n  );\n\n  const clear = useCallback(\n    () =>\n      dispatch({ type: \"CLEAR\", initialPresent: initialPresentRef.current }),\n    [],\n  );\n\n  return {\n    state: state.present,\n    set,\n    undo,\n    redo,\n    clear,\n    canUndo,\n    canRedo,\n  };\n}\n",
    "js": "export const useHistoryStateReducer = (state, action) => {\n  const { past, present, future } = state;\n  switch (action.type) {\n    case \"UNDO\":\n      if (past.length === 0) return state;\n      return {\n        past: past.slice(0, past.length - 1),\n        present: past[past.length - 1],\n        future: [present, ...future],\n      };\n    case \"REDO\":\n      if (future.length === 0) return state;\n      return {\n        past: [...past, present],\n        present: future[0],\n        future: future.slice(1),\n      };\n    case \"SET\":\n      if (action.newPresent === present) return state;\n      return {\n        past: [...past, present],\n        present: action.newPresent,\n        future: [],\n      };\n    case \"CLEAR\":\n      return {\n        past: [],\n        present: action.initialPresent,\n        future: [],\n      };\n    default:\n      throw new Error(\"Unsupported action type\");\n  }\n};\nexport function useHistoryState(initialPresent) {\n  const initialPresentRef = useRef(initialPresent);\n  const [state, dispatch] = useReducer((s, a) => useHistoryStateReducer(s, a), {\n    past: [],\n    present: initialPresentRef.current,\n    future: [],\n  });\n  const canUndo = state.past.length !== 0;\n  const canRedo = state.future.length !== 0;\n  const undo = useCallback(() => {\n    if (canUndo) dispatch({ type: \"UNDO\" });\n  }, [canUndo]);\n  const redo = useCallback(() => {\n    if (canRedo) dispatch({ type: \"REDO\" });\n  }, [canRedo]);\n  const set = useCallback(\n    (newPresent) => dispatch({ type: \"SET\", newPresent }),\n    [],\n  );\n  const clear = useCallback(\n    () =>\n      dispatch({ type: \"CLEAR\", initialPresent: initialPresentRef.current }),\n    [],\n  );\n  return {\n    state: state.present,\n    set,\n    undo,\n    redo,\n    clear,\n    canUndo,\n    canRedo,\n  };\n}\n"
  }
}