{
  "$schema": "https://sse-hooks.vercel.app/api/registry/schema/hook.json",
  "name": "use-media-query",
  "type": "registry:hook",
  "title": "useMediaQuery",
  "description": "Hook options.",
  "dependencies": [
    "react"
  ],
  "registryDependencies": [
    "use-isomorphic-layout-effect"
  ],
  "api": {
    "tags": {
      "category": "sensors",
      "see": "[Documentation](https://sse-hooks.vercel.app/docs/hooks/use-media-query)",
      "public": true
    },
    "types": [],
    "parameters": [
      {
        "name": "query",
        "type": "string",
        "isOptional": false,
        "description": "- The media query to track."
      },
      {
        "name": "{\r\n    defaultValue = false,\r\n    initializeWithValue = true,\r\n  }",
        "type": "UseMediaQueryOptions",
        "isOptional": true,
        "defaultValue": "{}",
        "properties": [
          {
            "name": "defaultValue",
            "type": "boolean | undefined",
            "isOptional": true,
            "description": "The default value to return if the hook is being run on the server.",
            "defaultValue": "false"
          },
          {
            "name": "initializeWithValue",
            "type": "boolean | undefined",
            "isOptional": true,
            "description": "If `true` (default), the hook will initialize reading the media query. In SSR, you should set it to `false`, returning `options.defaultValue` or `false` initially.",
            "defaultValue": "true"
          }
        ]
      }
    ],
    "returnType": {
      "name": "boolean",
      "description": "The current state of the media query (true if the query matches, false otherwise)."
    }
  },
  "file": {
    "path": "use-media-query.ts",
    "content": "import { useState } from \"react\";\nimport { useIsomorphicLayoutEffect } from \"./use-isomorphic-layout-effect\";\n\n/** Hook options. */\ntype UseMediaQueryOptions = {\n  /**\n   * The default value to return if the hook is being run on the server.\n   * @default false\n   */\n  defaultValue?: boolean;\n  /**\n   * If `true` (default), the hook will initialize reading the media query. In SSR, you should set it to `false`, returning `options.defaultValue` or `false` initially.\n   * @default true\n   */\n  initializeWithValue?: boolean;\n};\n\nconst IS_SERVER = typeof window === \"undefined\";\n\n/**\n * Custom hook that tracks the state of a media query using the [`Match Media API`](https://developer.mozilla.org/en-US/docs/Web/API/Window/matchMedia).\n * @category sensors\n * @param {string} query - The media query to track.\n * @param {?UseMediaQueryOptions} [options] - The options for customizing the behavior of the hook (optional).\n * @returns {boolean} The current state of the media query (true if the query matches, false otherwise).\n * @see [Documentation](https://sse-hooks.vercel.app/docs/hooks/use-media-query)\n * @public\n */\nexport function useMediaQuery(\n  query: string,\n  {\n    defaultValue = false,\n    initializeWithValue = true,\n  }: UseMediaQueryOptions = {},\n): boolean {\n  const getMatches = (query: string): boolean => {\n    if (IS_SERVER) {\n      return defaultValue;\n    }\n    return window.matchMedia(query).matches;\n  };\n\n  const [matches, setMatches] = useState<boolean>(() => {\n    if (initializeWithValue) {\n      return getMatches(query);\n    }\n    return defaultValue;\n  });\n\n  // Handles the change event of the media query.\n  function handleChange() {\n    setMatches(getMatches(query));\n  }\n\n  useIsomorphicLayoutEffect(() => {\n    const matchMedia = window.matchMedia(query);\n\n    // Triggered at the first client-side load and if query changes\n    handleChange();\n\n    // Use deprecated `addListener` and `removeListener` to support Safari < 14 (#135)\n    if (matchMedia.addListener) {\n      matchMedia.addListener(handleChange);\n    } else {\n      matchMedia.addEventListener(\"change\", handleChange);\n    }\n\n    return () => {\n      if (matchMedia.removeListener) {\n        matchMedia.removeListener(handleChange);\n      } else {\n        matchMedia.removeEventListener(\"change\", handleChange);\n      }\n    };\n  }, [query]);\n\n  return matches;\n}\n",
    "js": "import { useState } from \"react\";\nimport { useIsomorphicLayoutEffect } from \"./use-isomorphic-layout-effect\";\nconst IS_SERVER = typeof window === \"undefined\";\nexport function useMediaQuery(\n  query,\n  { defaultValue = false, initializeWithValue = true } = {},\n) {\n  const getMatches = (query) => {\n    if (IS_SERVER) {\n      return defaultValue;\n    }\n    return window.matchMedia(query).matches;\n  };\n  const [matches, setMatches] = useState(() => {\n    if (initializeWithValue) {\n      return getMatches(query);\n    }\n    return defaultValue;\n  });\n  function handleChange() {\n    setMatches(getMatches(query));\n  }\n  useIsomorphicLayoutEffect(() => {\n    const matchMedia = window.matchMedia(query);\n    handleChange();\n    if (matchMedia.addListener) {\n      matchMedia.addListener(handleChange);\n    } else {\n      matchMedia.addEventListener(\"change\", handleChange);\n    }\n    return () => {\n      if (matchMedia.removeListener) {\n        matchMedia.removeListener(handleChange);\n      } else {\n        matchMedia.removeEventListener(\"change\", handleChange);\n      }\n    };\n  }, [query]);\n  return matches;\n}\n"
  }
}