{
  "$schema": "https://sse-hooks.vercel.app/api/registry/schema/hook.json",
  "name": "use-ternary-dark-mode",
  "type": "registry:hook",
  "title": "useTernaryDarkMode",
  "description": "Ternary dark mode options.",
  "dependencies": [
    "react"
  ],
  "registryDependencies": [
    "use-local-storage",
    "use-media-query"
  ],
  "api": {
    "tags": {
      "category": "dom",
      "see": "[Documentation](https://sse-hooks.vercel.app/docs/hooks/use-ternary-dark-mode)",
      "public": true
    },
    "types": [
      {
        "name": "TernaryDarkMode",
        "description": "Ternary dark mode options.",
        "kind": "union",
        "values": [
          "\"system\"",
          "\"dark\"",
          "\"light\""
        ]
      }
    ],
    "parameters": [
      {
        "name": "{\r\n  defaultValue = \"system\",\r\n  localStorageKey = LOCAL_STORAGE_KEY,\r\n  initializeWithValue = true,\r\n}",
        "type": "TernaryDarkModeOptions",
        "isOptional": true,
        "defaultValue": "{}",
        "properties": [
          {
            "name": "defaultValue",
            "type": "TernaryDarkMode | undefined",
            "isOptional": true,
            "description": "The default value for the dark mode.",
            "defaultValue": "'system'"
          },
          {
            "name": "localStorageKey",
            "type": "string | undefined",
            "isOptional": true,
            "description": "The key for storing dark mode preference in local storage.",
            "defaultValue": "'sse-hooks-ternary-dark-mode'"
          },
          {
            "name": "initializeWithValue",
            "type": "boolean | undefined",
            "isOptional": true,
            "description": "If `true` (default), the hook will initialize reading `localStorage`. In SSR, you should set it to `false`, returning default values initially.",
            "defaultValue": "true"
          }
        ]
      }
    ],
    "returnType": {
      "name": "TernaryDarkModeReturn",
      "description": "An object containing the dark mode state and helper functions.",
      "properties": [
        {
          "name": "isDarkMode",
          "type": "boolean",
          "isOptional": false,
          "description": "The current state of the dark mode."
        },
        {
          "name": "ternaryDarkMode",
          "type": "TernaryDarkMode",
          "isOptional": false,
          "description": "The current state of the dark mode."
        },
        {
          "name": "setTernaryDarkMode",
          "type": "React.Dispatch<React.SetStateAction<TernaryDarkMode>>",
          "isOptional": false,
          "description": "A function to set the dark mode state."
        },
        {
          "name": "toggleTernaryDarkMode",
          "type": "() => void",
          "isOptional": false,
          "description": "A function to toggle the dark mode state."
        }
      ]
    }
  },
  "file": {
    "path": "use-ternary-dark-mode.ts",
    "content": "const COLOR_SCHEME_QUERY = \"(prefers-color-scheme: dark)\";\nconst LOCAL_STORAGE_KEY = \"sse-hooks-ternary-dark-mode\";\n\n/** Ternary dark mode options. */\nexport type TernaryDarkMode = \"system\" | \"dark\" | \"light\";\n\n/** Options for the `useTernaryDarkMode` hook. */\nexport type TernaryDarkModeOptions = {\n  /**\n   * The default value for the dark mode.\n   * @default 'system'\n   */\n  defaultValue?: TernaryDarkMode;\n  /**\n   * The key for storing dark mode preference in local storage.\n   * @default 'sse-hooks-ternary-dark-mode'\n   */\n  localStorageKey?: string;\n  /**\n   * If `true` (default), the hook will initialize reading `localStorage`. In SSR, you should set it to `false`, returning default values initially.\n   * @default true\n   */\n  initializeWithValue?: boolean;\n};\n\n/** Represents the return type of the `useTernaryDarkMode` hook. */\nexport type TernaryDarkModeReturn = {\n  /** The current state of the dark mode. */\n  isDarkMode: boolean;\n  /** The current state of the dark mode. */\n  ternaryDarkMode: TernaryDarkMode;\n  /** A function to set the dark mode state. */\n  setTernaryDarkMode: Dispatch<SetStateAction<TernaryDarkMode>>;\n  /** A function to toggle the dark mode state. */\n  toggleTernaryDarkMode: () => void;\n};\n\n/**\n * Custom hook that manages ternary (system, dark, light) dark mode with local storage support.\n *\n * @category dom\n * @param {?TernaryDarkModeOptions | string} [options] - Options or the local storage key for the hook.\n * @returns {TernaryDarkModeReturn} An object containing the dark mode state and helper functions.\n * @see [Documentation](https://sse-hooks.vercel.app/docs/hooks/use-ternary-dark-mode)\n * @public\n */\nexport function useTernaryDarkMode({\n  defaultValue = \"system\",\n  localStorageKey = LOCAL_STORAGE_KEY,\n  initializeWithValue = true,\n}: TernaryDarkModeOptions = {}): TernaryDarkModeReturn {\n  const isDarkOS = useMediaQuery(COLOR_SCHEME_QUERY, { initializeWithValue });\n  const [mode, setMode] = useLocalStorage(localStorageKey, defaultValue, {\n    initializeWithValue,\n  });\n\n  const isDarkMode = mode === \"dark\" || (mode === \"system\" && isDarkOS);\n\n  const toggleTernaryDarkMode = () => {\n    const modes: TernaryDarkMode[] = [\"light\", \"system\", \"dark\"];\n    setMode((prevMode): TernaryDarkMode => {\n      const nextIndex = (modes.indexOf(prevMode) + 1) % modes.length;\n      return modes[nextIndex];\n    });\n  };\n\n  return {\n    isDarkMode,\n    ternaryDarkMode: mode,\n    setTernaryDarkMode: setMode,\n    toggleTernaryDarkMode,\n  };\n}\n",
    "js": "const COLOR_SCHEME_QUERY = \"(prefers-color-scheme: dark)\";\nconst LOCAL_STORAGE_KEY = \"sse-hooks-ternary-dark-mode\";\nexport function useTernaryDarkMode({\n  defaultValue = \"system\",\n  localStorageKey = LOCAL_STORAGE_KEY,\n  initializeWithValue = true,\n} = {}) {\n  const isDarkOS = useMediaQuery(COLOR_SCHEME_QUERY, { initializeWithValue });\n  const [mode, setMode] = useLocalStorage(localStorageKey, defaultValue, {\n    initializeWithValue,\n  });\n  const isDarkMode = mode === \"dark\" || (mode === \"system\" && isDarkOS);\n  const toggleTernaryDarkMode = () => {\n    const modes = [\"light\", \"system\", \"dark\"];\n    setMode((prevMode) => {\n      const nextIndex = (modes.indexOf(prevMode) + 1) % modes.length;\n      return modes[nextIndex];\n    });\n  };\n  return {\n    isDarkMode,\n    ternaryDarkMode: mode,\n    setTernaryDarkMode: setMode,\n    toggleTernaryDarkMode,\n  };\n}\n"
  }
}