{
  "$schema": "https://sse-hooks.vercel.app/api/registry/schema/hook.json",
  "name": "use-kbd",
  "type": "registry:hook",
  "title": "useKBD",
  "description": "Custom hook that detects the operating system (Mac vs. Windows/Linux) and provides a normalized map of keyboard keys (e.g., mapping \"Meta\" to \"Command\" on Mac and \"Ctrl\" on Windows). ```tsx const { isMac, getKbdKey } = useKbd(); // Returns \"⌘\" on Mac, \"Ctrl\" on Windows const metaSymbol = getKbdKey('meta'); return <div>Press {metaSymbol} + C to copy</div>; ```",
  "dependencies": [
    "react"
  ],
  "registryDependencies": [],
  "api": {
    "parameters": [],
    "returnType": {
      "name": "void"
    }
  },
  "file": {
    "path": "use-kbd.ts",
    "content": "// This file is auto-generated. Do not edit manually.\n\nimport { useState, useEffect, useCallback } from \"react\";\n\ntype KbdKeysSpecificMap = {\n  meta: string;\n  alt: string;\n  ctrl: string;\n};\n\nexport const kbdKeysMap = {\n  meta: \"\",\n  ctrl: \"\",\n  alt: \"\",\n  win: \"⊞\",\n  command: \"⌘\",\n  shift: \"⇧\",\n  control: \"⌃\",\n  option: \"⌥\",\n  enter: \"↵\",\n  delete: \"⌦\",\n  backspace: \"⌫\",\n  escape: \"Esc\",\n  tab: \"⇥\",\n  capslock: \"⇪\",\n  arrowup: \"↑\",\n  arrowright: \"→\",\n  arrowdown: \"↓\",\n  arrowleft: \"←\",\n  pageup: \"⇞\",\n  pagedown: \"⇟\",\n  home: \"↖\",\n  end: \"↘\",\n} as const;\n\nexport type KbdKey = keyof typeof kbdKeysMap;\nexport type KbdKeySpecific = keyof KbdKeysSpecificMap;\n\n/**\n * Custom hook that detects the operating system (Mac vs. Windows/Linux) and provides\n * a normalized map of keyboard keys (e.g., mapping \"Meta\" to \"Command\" on Mac and \"Ctrl\" on Windows).\n * @category utilities\n * @returns {Object} An object containing the OS detection state and a key mapping function.\n * @public\n * @see [Documentation](/docs/hooks/use-kbd)\n * @example\n * ```tsx\n * const { isMac, getKbdKey } = useKbd();\n * // Returns \"⌘\" on Mac, \"Ctrl\" on Windows\n * const metaSymbol = getKbdKey('meta');\n * return <div>Press {metaSymbol} + C to copy</div>;\n * ```\n */\nexport const useKbd = () => {\n  // Initialize as false for SSR consistency\n  const [isMac, setIsMac] = useState<boolean>(false);\n\n  useEffect(() => {\n    // Check if we are in the browser\n    const isClient =\n      typeof window !== \"undefined\" && typeof navigator !== \"undefined\";\n\n    if (isClient) {\n      const isMacUserAgent = /Macintosh/.test(navigator.userAgent);\n      setIsMac(isMacUserAgent);\n    }\n  }, []);\n\n  // Construct the specific map based on current OS state\n  const kbdKeysSpecificMap: KbdKeysSpecificMap = {\n    meta: isMac ? kbdKeysMap.command : \"Ctrl\",\n    ctrl: isMac ? kbdKeysMap.control : \"Ctrl\",\n    alt: isMac ? kbdKeysMap.option : \"Alt\",\n  };\n\n  const getKbdKey = useCallback(\n    (value?: KbdKey | string) => {\n      if (!value) {\n        return undefined;\n      }\n\n      if ([\"meta\", \"alt\", \"ctrl\"].includes(value)) {\n        return kbdKeysSpecificMap[value as KbdKeySpecific];\n      }\n\n      // Return the mapped symbol or the original string if not found\n      return kbdKeysMap[value as KbdKey] || value;\n    },\n    [isMac],\n  ); // Re-create function if OS detection changes\n\n  return {\n    isMac,\n    getKbdKey,\n  };\n};\n",
    "js": "import { useState, useEffect, useCallback } from \"react\";\nexport const kbdKeysMap = {\n    meta: \"\",\n    ctrl: \"\",\n    alt: \"\",\n    win: \"⊞\",\n    command: \"⌘\",\n    shift: \"⇧\",\n    control: \"⌃\",\n    option: \"⌥\",\n    enter: \"↵\",\n    delete: \"⌦\",\n    backspace: \"⌫\",\n    escape: \"Esc\",\n    tab: \"⇥\",\n    capslock: \"⇪\",\n    arrowup: \"↑\",\n    arrowright: \"→\",\n    arrowdown: \"↓\",\n    arrowleft: \"←\",\n    pageup: \"⇞\",\n    pagedown: \"⇟\",\n    home: \"↖\",\n    end: \"↘\",\n};\nexport const useKbd = () => {\n    const [isMac, setIsMac] = useState(false);\n    useEffect(() => {\n        const isClient = typeof window !== \"undefined\" && typeof navigator !== \"undefined\";\n        if (isClient) {\n            const isMacUserAgent = /Macintosh/.test(navigator.userAgent);\n            setIsMac(isMacUserAgent);\n        }\n    }, []);\n    const kbdKeysSpecificMap = {\n        meta: isMac ? kbdKeysMap.command : \"Ctrl\",\n        ctrl: isMac ? kbdKeysMap.control : \"Ctrl\",\n        alt: isMac ? kbdKeysMap.option : \"Alt\",\n    };\n    const getKbdKey = useCallback((value) => {\n        if (!value) {\n            return undefined;\n        }\n        if ([\"meta\", \"alt\", \"ctrl\"].includes(value)) {\n            return kbdKeysSpecificMap[value];\n        }\n        return kbdKeysMap[value] || value;\n    }, [isMac]);\n    return {\n        isMac,\n        getKbdKey,\n    };\n};"
  }
}