{
  "$schema": "https://sse-hooks.vercel.app/api/registry/schema/hook.json",
  "name": "use-script",
  "type": "registry:hook",
  "title": "useScript",
  "description": "Script loading status.",
  "dependencies": [
    "react"
  ],
  "registryDependencies": [],
  "api": {
    "tags": {
      "category": "dom",
      "see": "[Documentation](https://sse-hooks.vercel.app/docs/hooks/use-script)",
      "public": true
    },
    "types": [
      {
        "name": "UseScriptStatus",
        "description": "Script loading status.",
        "kind": "union",
        "values": [
          "\"idle\"",
          "\"loading\"",
          "\"ready\"",
          "\"error\""
        ]
      }
    ],
    "parameters": [
      {
        "name": "src",
        "type": "string | null",
        "isOptional": false,
        "description": "- The source URL of the script to load. Set to `null` or omit to prevent loading (optional)."
      },
      {
        "name": "options",
        "type": "UseScriptOptions",
        "isOptional": true,
        "description": "- Additional options for controlling script loading (optional).",
        "properties": [
          {
            "name": "shouldPreventLoad",
            "type": "boolean | undefined",
            "isOptional": true,
            "description": "If `true`, prevents the script from being loaded (optional)."
          },
          {
            "name": "removeOnUnmount",
            "type": "boolean | undefined",
            "isOptional": true,
            "description": "If `true`, removes the script from the DOM when the component unmounts (optional)."
          },
          {
            "name": "id",
            "type": "string | undefined",
            "isOptional": true,
            "description": "Script's `id` (optional)."
          }
        ]
      }
    ],
    "returnType": {
      "name": "UseScriptStatus",
      "description": "The status of the script loading, which can be one of 'idle', 'loading', 'ready', or 'error'1."
    }
  },
  "file": {
    "path": "use-script.ts",
    "content": "import { useEffect, useState } from \"react\";\n\n/** Script loading status. */\ntype UseScriptStatus = \"idle\" | \"loading\" | \"ready\" | \"error\";\n\n/** Hook options. */\ntype UseScriptOptions = {\n  /** If `true`, prevents the script from being loaded (optional). */\n  shouldPreventLoad?: boolean;\n  /** If `true`, removes the script from the DOM when the component unmounts (optional). */\n  removeOnUnmount?: boolean;\n  /** Script's `id` (optional). */\n  id?: string;\n};\n\n// Cached script statuses\nconst cachedScriptStatuses = new Map<string, UseScriptStatus | undefined>();\n\n/**\n * Gets the script element with the specified source URL.\n * @param {string} src - The source URL of the script to get.\n * @returns {{ node: HTMLScriptElement | null, status: UseScriptStatus | undefined }} The script element and its loading status.\n * @public\n */\nfunction getScriptNode(src: string) {\n  const node: HTMLScriptElement | null = document.querySelector(\n    `script[src=\"${src}\"]`,\n  );\n\n  const status = node?.getAttribute(\"data-status\") as\n    | UseScriptStatus\n    | undefined;\n\n  return {\n    node,\n    status,\n  };\n}\n\n/**\n * Custom hook that dynamically loads scripts and tracking their loading status.\n *\n * @category dom\n * @param {string | null} src - The source URL of the script to load. Set to `null` or omit to prevent loading (optional).\n * @param {UseScriptOptions} [options] - Additional options for controlling script loading (optional).\n * @returns {UseScriptStatus} The status of the script loading, which can be one of 'idle', 'loading', 'ready', or 'error'1.\n * @see [Documentation](https://sse-hooks.vercel.app/docs/hooks/use-script)\n * @public\n */\nexport function useScript(\n  src: string | null,\n  options?: UseScriptOptions,\n): UseScriptStatus {\n  const [status, setStatus] = useState<UseScriptStatus>(() => {\n    if (!src || options?.shouldPreventLoad) {\n      return \"idle\";\n    }\n\n    if (typeof window === \"undefined\") {\n      // SSR Handling - always return 'loading'\n      return \"loading\";\n    }\n\n    return cachedScriptStatuses.get(src) ?? \"loading\";\n  });\n\n  useEffect(() => {\n    if (!src || options?.shouldPreventLoad) {\n      return;\n    }\n\n    const cachedScriptStatus = cachedScriptStatuses.get(src);\n    if (cachedScriptStatus === \"ready\" || cachedScriptStatus === \"error\") {\n      // If the script is already cached, set its status immediately\n      setStatus(cachedScriptStatus);\n      return;\n    }\n\n    // Fetch existing script element by src\n    // It may have been added by another instance of this hook\n    const script = getScriptNode(src);\n    let scriptNode = script.node;\n\n    if (!scriptNode) {\n      // Create script element and add it to document body\n      scriptNode = document.createElement(\"script\");\n      scriptNode.src = src;\n      scriptNode.async = true;\n      if (options?.id) {\n        scriptNode.id = options.id;\n      }\n      scriptNode.setAttribute(\"data-status\", \"loading\");\n      document.body.appendChild(scriptNode);\n\n      // Store status in attribute on script\n      // This can be read by other instances of this hook\n      const setAttributeFromEvent = (event: Event) => {\n        const scriptStatus: UseScriptStatus =\n          event.type === \"load\" ? \"ready\" : \"error\";\n\n        scriptNode?.setAttribute(\"data-status\", scriptStatus);\n      };\n\n      scriptNode.addEventListener(\"load\", setAttributeFromEvent);\n      scriptNode.addEventListener(\"error\", setAttributeFromEvent);\n    } else {\n      // Grab existing script status from attribute and set to state.\n      setStatus(script.status ?? cachedScriptStatus ?? \"loading\");\n    }\n\n    // Script event handler to update status in state\n    // Note: Even if the script already exists we still need to add\n    // event handlers to update the state for *this* hook instance.\n    const setStateFromEvent = (event: Event) => {\n      const newStatus = event.type === \"load\" ? \"ready\" : \"error\";\n      setStatus(newStatus);\n      cachedScriptStatuses.set(src, newStatus);\n    };\n\n    // Add event listeners\n    scriptNode.addEventListener(\"load\", setStateFromEvent);\n    scriptNode.addEventListener(\"error\", setStateFromEvent);\n\n    // Remove event listeners on cleanup\n    return () => {\n      if (scriptNode) {\n        scriptNode.removeEventListener(\"load\", setStateFromEvent);\n        scriptNode.removeEventListener(\"error\", setStateFromEvent);\n      }\n\n      if (scriptNode && options?.removeOnUnmount) {\n        scriptNode.remove();\n        cachedScriptStatuses.delete(src);\n      }\n    };\n  }, [src, options?.shouldPreventLoad, options?.removeOnUnmount, options?.id]);\n\n  return status;\n}\n",
    "js": "import { useEffect, useState } from \"react\";\nconst cachedScriptStatuses = new Map();\nfunction getScriptNode(src) {\n  const node = document.querySelector(`script[src=\"${src}\"]`);\n  const status = node?.getAttribute(\"data-status\");\n  return {\n    node,\n    status,\n  };\n}\nexport function useScript(src, options) {\n  const [status, setStatus] = useState(() => {\n    if (!src || options?.shouldPreventLoad) {\n      return \"idle\";\n    }\n    if (typeof window === \"undefined\") {\n      return \"loading\";\n    }\n    return cachedScriptStatuses.get(src) ?? \"loading\";\n  });\n  useEffect(() => {\n    if (!src || options?.shouldPreventLoad) {\n      return;\n    }\n    const cachedScriptStatus = cachedScriptStatuses.get(src);\n    if (cachedScriptStatus === \"ready\" || cachedScriptStatus === \"error\") {\n      setStatus(cachedScriptStatus);\n      return;\n    }\n    const script = getScriptNode(src);\n    let scriptNode = script.node;\n    if (!scriptNode) {\n      scriptNode = document.createElement(\"script\");\n      scriptNode.src = src;\n      scriptNode.async = true;\n      if (options?.id) {\n        scriptNode.id = options.id;\n      }\n      scriptNode.setAttribute(\"data-status\", \"loading\");\n      document.body.appendChild(scriptNode);\n      const setAttributeFromEvent = (event) => {\n        const scriptStatus = event.type === \"load\" ? \"ready\" : \"error\";\n        scriptNode?.setAttribute(\"data-status\", scriptStatus);\n      };\n      scriptNode.addEventListener(\"load\", setAttributeFromEvent);\n      scriptNode.addEventListener(\"error\", setAttributeFromEvent);\n    } else {\n      setStatus(script.status ?? cachedScriptStatus ?? \"loading\");\n    }\n    const setStateFromEvent = (event) => {\n      const newStatus = event.type === \"load\" ? \"ready\" : \"error\";\n      setStatus(newStatus);\n      cachedScriptStatuses.set(src, newStatus);\n    };\n    scriptNode.addEventListener(\"load\", setStateFromEvent);\n    scriptNode.addEventListener(\"error\", setStateFromEvent);\n    return () => {\n      if (scriptNode) {\n        scriptNode.removeEventListener(\"load\", setStateFromEvent);\n        scriptNode.removeEventListener(\"error\", setStateFromEvent);\n      }\n      if (scriptNode && options?.removeOnUnmount) {\n        scriptNode.remove();\n        cachedScriptStatuses.delete(src);\n      }\n    };\n  }, [src, options?.shouldPreventLoad, options?.removeOnUnmount, options?.id]);\n  return status;\n}\n"
  }
}