{
  "$schema": "https://sse-hooks.vercel.app/api/registry/schema/hook.json",
  "name": "use-map",
  "type": "registry:hook",
  "title": "useMap",
  "description": "Represents the type for either a Map or an array of key-value pairs.",
  "dependencies": [
    "react"
  ],
  "registryDependencies": [],
  "api": {
    "tags": {
      "category": "state",
      "template": "- The type of values in the map.",
      "public": true,
      "see": "[Documentation](/docs/use-map)",
      "example": "```tsx\r\nconst [map, mapActions] = useMap();\r\n// Access the `map` state and use `mapActions` to set, remove, or reset entries.\r\n```"
    },
    "types": [
      {
        "name": "MapOrEntries",
        "description": "Represents the type for either a Map or an array of key-value pairs.",
        "kind": "union",
        "values": [
          "Map<K, V>",
          "[K, V][]"
        ]
      },
      {
        "name": "UseMapReturn",
        "description": "Represents the return type of the `useMap` hook.\r\nWe hide some setters from the returned map to disable autocompletion.",
        "kind": "alias",
        "type": "UseMapReturn<K, V>"
      }
    ],
    "parameters": [
      {
        "name": "initialState",
        "type": "MapOrEntries<K, V>",
        "isOptional": true,
        "defaultValue": "new Map()",
        "description": "- The initial state of the map as a Map or an array of key-value pairs (optional)."
      }
    ],
    "returnType": {
      "name": "UseMapReturn<K, V>",
      "description": "A tuple containing the map state and actions to interact with the map."
    }
  },
  "file": {
    "path": "use-map.ts",
    "content": "// This file is auto-generated. Do not edit manually.\n\nimport { useCallback, useState } from \"react\";\n\n/**\n * Represents the type for either a Map or an array of key-value pairs.\n * @template K - The type of keys in the map.\n * @template V - The type of values in the map.\n */\ntype MapOrEntries<K, V> = Map<K, V> | [K, V][];\n\n/**\n * Represents the actions available to interact with the map state.\n * @template K - The type of keys in the map.\n * @template V - The type of values in the map.\n */\ntype UseMapActions<K, V> = {\n  /** Set a key-value pair in the map. */\n  set: (key: K, value: V) => void;\n  /** Set all key-value pairs in the map. */\n  setAll: (entries: MapOrEntries<K, V>) => void;\n  /** Remove a key-value pair from the map. */\n  remove: (key: K) => void;\n  /** Reset the map to an empty state. */\n  reset: Map<K, V>[\"clear\"];\n};\n\n/**\n * Represents the return type of the `useMap` hook.\n * We hide some setters from the returned map to disable autocompletion.\n * @template K - The type of keys in the map.\n * @template V - The type of values in the map.\n */\ntype UseMapReturn<K, V> = [\n  Omit<Map<K, V>, \"set\" | \"clear\" | \"delete\">,\n  UseMapActions<K, V>,\n];\n\n/**\n * Custom hook that manages a key-value [`Map`](https://developer.mozilla.org/en-US/docs/Web/JavaScript/Reference/Global_Objects/Map) state with setter actions.\n *\n * @category state\n * @template K - The type of keys in the map.\n * @template V - The type of values in the map.\n * @param {MapOrEntries<K, V>} [initialState] - The initial state of the map as a Map or an array of key-value pairs (optional).\n * @returns {UseMapReturn<K, V>} A tuple containing the map state and actions to interact with the map.\n * @public\n * @see [Documentation](/docs/use-map)\n * @example\n * ```tsx\n * const [map, mapActions] = useMap();\n * // Access the `map` state and use `mapActions` to set, remove, or reset entries.\n * ```\n */\nexport function useMap<K, V>(\n  initialState: MapOrEntries<K, V> = new Map(),\n): UseMapReturn<K, V> {\n  const [map, setMap] = useState(new Map(initialState));\n\n  const actions: UseMapActions<K, V> = {\n    set: useCallback((key, value) => {\n      setMap((prev) => {\n        const copy = new Map(prev);\n        copy.set(key, value);\n        return copy;\n      });\n    }, []),\n\n    setAll: useCallback((entries) => {\n      setMap(() => new Map(entries));\n    }, []),\n\n    remove: useCallback((key) => {\n      setMap((prev) => {\n        const copy = new Map(prev);\n        copy.delete(key);\n        return copy;\n      });\n    }, []),\n\n    reset: useCallback(() => {\n      setMap(() => new Map());\n    }, []),\n  };\n\n  return [map, actions];\n}\n",
    "js": "import { useCallback, useState } from \"react\";\nexport function useMap(initialState = new Map()) {\n    const [map, setMap] = useState(new Map(initialState));\n    const actions = {\n        set: useCallback((key, value) => {\n            setMap((prev) => {\n                const copy = new Map(prev);\n                copy.set(key, value);\n                return copy;\n            });\n        }, []),\n        setAll: useCallback((entries) => {\n            setMap(() => new Map(entries));\n        }, []),\n        remove: useCallback((key) => {\n            setMap((prev) => {\n                const copy = new Map(prev);\n                copy.delete(key);\n                return copy;\n            });\n        }, []),\n        reset: useCallback(() => {\n            setMap(() => new Map());\n        }, []),\n    };\n    return [map, actions];\n}"
  }
}