{
  "$schema": "https://sse-hooks.vercel.app/api/registry/schema/hook.json",
  "name": "use-breakpoint",
  "type": "registry:hook",
  "title": "useBreakpoint",
  "description": "Breakpoints from Tailwind V2",
  "dependencies": [],
  "registryDependencies": [
    "use-media-query"
  ],
  "api": {
    "tags": {},
    "types": [],
    "parameters": [
      {
        "name": "breakpoints",
        "type": "BreakPoints",
        "isOptional": false
      }
    ],
    "returnType": {
      "name": "\"{ useGreater: (k: BreakPointsKey) => boolean; useSmaller: (k: BreakPointsKey) => boolean; useBetween: (a: BreakPointsKey, b: BreakPointsKey) => boolean; isGreater(k: BreakPointsKey): boolean; isSmaller(k: BreakPointsKey): boolean; isInBetween(a: BreakPointsKey, b: BreakPointsKey): boolean; }\"",
      "properties": [
        {
          "name": "useGreater",
          "type": "(k: BreakPointsKey) => boolean",
          "isOptional": false
        },
        {
          "name": "useSmaller",
          "type": "(k: BreakPointsKey) => boolean",
          "isOptional": false
        },
        {
          "name": "useBetween",
          "type": "(a: BreakPointsKey, b: BreakPointsKey) => boolean",
          "isOptional": false
        },
        {
          "name": "isGreater",
          "type": "(k: BreakPointsKey) => boolean",
          "isOptional": false,
          "description": "Utility function that returns a boolean if screen width is greater than given breakpoint."
        },
        {
          "name": "isSmaller",
          "type": "(k: BreakPointsKey) => boolean",
          "isOptional": false,
          "description": "Utility function that returns a boolean if screen width is smaller than given breakpoint."
        },
        {
          "name": "isInBetween",
          "type": "(a: BreakPointsKey, b: BreakPointsKey) => boolean",
          "isOptional": false,
          "description": "Utility function that returns a boolean if screen width is between two given breakpoint."
        }
      ]
    }
  },
  "file": {
    "path": "use-breakpoint.ts",
    "content": "// This file is auto-generated. Do not edit manually.\n\n/**\n * Breakpoints from Tailwind V2\n *\n * @see https://tailwindcss.com/docs/breakpoints\n */\nexport const breakpointsTailwind = {\n  sm: 640,\n  md: 768,\n  lg: 1024,\n  xl: 1280,\n  \"2xl\": 1536,\n};\n\n/**\n * Breakpoints from Bootstrap V5\n *\n * @see https://getbootstrap.com/docs/5.0/layout/breakpoints\n */\nexport const breakpointsBootstrapV5 = {\n  sm: 576,\n  md: 768,\n  lg: 992,\n  xl: 1200,\n  xxl: 1400,\n};\n\n/**\n * Breakpoints from Vuetify V2\n *\n * @see https://vuetifyjs.com/en/features/breakpoints\n */\nexport const breakpointsVuetify = {\n  xs: 600,\n  sm: 960,\n  md: 1264,\n  lg: 1904,\n};\n\n/**\n * Breakpoints from Ant Design\n *\n * @see https://ant.design/components/layout/#breakpoint-width\n */\nexport const breakpointsAntDesign = {\n  xs: 480,\n  sm: 576,\n  md: 768,\n  lg: 992,\n  xl: 1200,\n  xxl: 1600,\n};\n\n/**\n * Sematic Breakpoints\n */\nexport const breakpointsSematic = {\n  mobileS: 320,\n  mobileM: 375,\n  mobileL: 425,\n  tablet: 768,\n  laptop: 1024,\n  laptopL: 1440,\n  desktop4K: 2560,\n};\n\nimport { useMediaQuery } from \"./use-media-query\";\n\nfunction match(query: string): boolean {\n  if (typeof window === \"undefined\") return false;\n\n  return window.matchMedia(query).matches;\n}\n\nexport function useBreakpoint<\n  BreakPoints extends Record<string, number>,\n  BreakPointsKey extends keyof BreakPoints = keyof BreakPoints,\n>(breakpoints: BreakPoints) {\n  return {\n    /**\n     * Hook that returns a boolean if screen width is greater than given breakpoint.\n     *\n     * @param k {string} breakpoint\n     * @returns boolean\n     *\n     * @see https://react-hooks-library.vercel.app/core/BreakPointHooks\n     **/\n    useGreater: (k: BreakPointsKey) => {\n      return useMediaQuery(`(min-width: ${breakpoints[k]}px)`);\n    },\n\n    /**\n     * Hook that returns a boolean if screen width is smaller than given breakpoint.\n     *\n     * @param k {string} breakpoint\n     * @param k {string} breakpoint\n     *\n     * @returns boolean\n     *\n     * @see https://react-hooks-library.vercel.app/core/BreakPointHooks\n     **/\n    useSmaller: (k: BreakPointsKey) => {\n      return useMediaQuery(`(max-width: ${breakpoints[k]}px)`);\n    },\n\n    /**\n     * Hook that returns a boolean if screen width is between two given breakpoint.\n     *\n     * @param a {string} breakpoint\n     * @param b {string} breakpoint\n     *\n     * @returns boolean\n     *\n     * @see https://react-hooks-library.vercel.app/core/BreakPointHooks\n     **/\n    useBetween: (a: BreakPointsKey, b: BreakPointsKey) => {\n      return useMediaQuery(\n        `(min-width: ${breakpoints[a]}px) and (max-width: ${breakpoints[b]}px)`,\n      );\n    },\n\n    /**\n     * Utility function that returns a boolean if screen width is greater than given breakpoint.\n     *\n     * @param k {string} breakpoint\n     *\n     * @see https://react-hooks-library.vercel.app/core/BreakPointHooks\n     **/\n    isGreater(k: BreakPointsKey) {\n      return match(`(min-width: ${breakpoints[k]}px)`);\n    },\n\n    /**\n     * Utility function that returns a boolean if screen width is smaller than given breakpoint.\n     *\n     * @param k {string} breakpoint\n     *\n     * @see https://react-hooks-library.vercel.app/core/BreakPointHooks\n     **/\n    isSmaller(k: BreakPointsKey) {\n      return match(`(max-width: ${breakpoints[k]}px)`);\n    },\n\n    /**\n     * Utility function that returns a boolean if screen width is between two given breakpoint.\n     *\n     * @param k {string} breakpoint\n     *\n     * @see https://react-hooks-library.vercel.app/core/BreakPointHooks\n     **/\n    isInBetween(a: BreakPointsKey, b: BreakPointsKey) {\n      return match(\n        `(min-width: ${breakpoints[a]}px) and (max-width: ${breakpoints[b]}px)`,\n      );\n    },\n  };\n}\n",
    "js": "export const breakpointsTailwind = {\n    sm: 640,\n    md: 768,\n    lg: 1024,\n    xl: 1280,\n    \"2xl\": 1536,\n};\nexport const breakpointsBootstrapV5 = {\n    sm: 576,\n    md: 768,\n    lg: 992,\n    xl: 1200,\n    xxl: 1400,\n};\nexport const breakpointsVuetify = {\n    xs: 600,\n    sm: 960,\n    md: 1264,\n    lg: 1904,\n};\nexport const breakpointsAntDesign = {\n    xs: 480,\n    sm: 576,\n    md: 768,\n    lg: 992,\n    xl: 1200,\n    xxl: 1600,\n};\nexport const breakpointsSematic = {\n    mobileS: 320,\n    mobileM: 375,\n    mobileL: 425,\n    tablet: 768,\n    laptop: 1024,\n    laptopL: 1440,\n    desktop4K: 2560,\n};\nimport { useMediaQuery } from \"./use-media-query\";\nfunction match(query) {\n    if (typeof window === \"undefined\")\n        return false;\n    return window.matchMedia(query).matches;\n}\nexport function useBreakpoint(breakpoints) {\n    return {\n        useGreater: (k) => {\n            return useMediaQuery(`(min-width: ${breakpoints[k]}px)`);\n        },\n        useSmaller: (k) => {\n            return useMediaQuery(`(max-width: ${breakpoints[k]}px)`);\n        },\n        useBetween: (a, b) => {\n            return useMediaQuery(`(min-width: ${breakpoints[a]}px) and (max-width: ${breakpoints[b]}px)`);\n        },\n        isGreater(k) {\n            return match(`(min-width: ${breakpoints[k]}px)`);\n        },\n        isSmaller(k) {\n            return match(`(max-width: ${breakpoints[k]}px)`);\n        },\n        isInBetween(a, b) {\n            return match(`(min-width: ${breakpoints[a]}px) and (max-width: ${breakpoints[b]}px)`);\n        },\n    };\n}"
  }
}